"ProjectID","Partner","Project","Project_Status","Pillars_supported_by_project","Activities_conducted2","Implementing_partner","Regions","Districts"
"ID-98","Restless Development Uganda","COVID-19 Activities","Ongoing Project","Risk communications","None,","","Busoga, Northbuganda","Jinja, Mayuge, Kayunga"
"ID-99","Takataka Plastics","Face Shields for Ugandan Medical Staff","New Project","Infection prevention, Logistics","Procure or construct IPC materials for health facilities, Procurement of Personal protective equipments (coveralls, masks, gloves, face shields, gumboots, N95 respirator, aprons, PPE full kit), None,","","Acholi, Acholi","Lamwo, Omoro, Amuru, Kitgum, Gulu, Agago, Pader, Nwoya, Lamwo, Omoro, Amuru, Kitgum, Gulu, Agago, Pader, Nwoya"
"ID-100","World Vision Uganda","World  Vision Uganda- West Nile Refugee Response COVID-19 community response","New Project","Coordination, Infection prevention, WASH, Mental health, Risk communications, Logistics","Activation of National Task Force, district task force and sub-committees., Develop and issue information products including situational reports on COVID-19, Procure or construct IPC materials for health facilities, Support engagements with authorities on improvement of WASH in congregation institutions using the standardized checklist., Procure WASH infrastructure, supplies and commodities to strengthen hygiene practices in affected communities, Conduct hygiene promotion and sensitization workshops on use of WASH commodities in congregational settings, Support community engagement meetings on improvement of WASH, Support the operationalization of WASH committees in the community., Supervise and monitor psychosocial services in the affected communities, Procurement of Personal protective equipments (coveralls, masks, gloves, face shields, gumboots, N95 respirator, aprons, PPE full kit), Procurement of thermoscanners for points of entry, Procurement of infared thermometers, Fuel and maintenance requirementst for central (delivery of medical supplies, IEC materials), Procurement of sanitizers, Procurement of water tanks, None,","","West Nile","Yumbe, Adjumani, Arua, Koboko, Moyo, Obongi"
"ID-101","LifeNet International","Protecting Ugandan Healthcare Workers","New Project","Coordination, Infection prevention, Surveillance, Laboratory, Case management, WASH, ICT innovations, Risk communications, Logistics, Human resources","Develop and issue information products including situational reports on COVID-19, Revise and disseminate adapted IPC standard operating procedures and strategy for IPC and hospital acquired infections for COVID-19 to health facilities, Procure or construct IPC materials for health facilities, Conduct IPC refresher training and onsite mentorship on standard and transmission-based precautions, Conduct surveillance for Hospital acquired infections for COVID-19 in health facilities., Orient Health workers on COVID-19 surveillance, Orientation of high volume private facilities on detection and linking of suspect and confirmed cases to the designated isolation facilities, Assess public and private health facilities for COVID-19 readiness (including IPC capacity, on-site Oxygen production and supply, and logistics) on a quarterly basis., Procure WASH infrastructure, supplies and commodities to strengthen hygiene practices in affected communities, Procurement of Personal protective equipments (coveralls, masks, gloves, face shields, gumboots, N95 respirator, aprons, PPE full kit), Procurement of infared thermometers, Procurement of sanitizers, Procurement of soap, Water, Sanitation & Hygiene transportation, last mile distribution, and other logistics costs, Ensure remuneration and compensation of health care providers,","","Busoga, Kampala, Northbuganda, Southbuganda","Iganga, Jinja, Mayuge, Kampala, Buikwe, Nakasongola, Mubende, Mukono, Nakaseke, Mityana, Masaka, Wakiso, Bukomansimbi, Mpigi, Lwengo, Ssembabule, Butambala, Kyotera, Rakai"
"ID-102","LifeNet International","Building Capacity of Frontline Healthcare Workers","Ongoing Project","Coordination, Infection prevention, WASH, ICT innovations","Monitor and supervise implementation of the plan by the national level, Develop and issue information products including situational reports on COVID-19, Revise and disseminate adapted IPC standard operating procedures and strategy for IPC and hospital acquired infections for COVID-19 to health facilities, Procure or construct IPC materials for health facilities, Conduct IPC refresher training and onsite mentorship on standard and transmission-based precautions, Conduct surveillance for Hospital acquired infections for COVID-19 in health facilities., Conduct hygiene promotion and sensitization workshops on use of WASH commodities in congregational settings, Support community engagement meetings on improvement of WASH, None,","","Busoga, Kampala, Northbuganda, Southbuganda","Iganga, Jinja, Mayuge, Kampala, Buikwe, Luwero, Nakasongola, Mubende, Mukono, Nakaseke, Mityana, Masaka, Wakiso, Bukomansimbi, Mpigi, Lwengo, Butambala, Kyotera, Rakai"
"ID-103","Catholic Relief Services","COVID-19 Activities","New Project","Infection prevention, Case management, Logistics","Procure or construct IPC materials for health facilities, Orientation of Health care workers in Regional Referral Hospitals, Severe Acute Respiratory Illness (SARI) sentinel sites on mangemnet of suspect and confirmed cases, Improvement of WASH facilities in Isolation/Quaranteen centres, Mobile toilet for isolation centers, None,  Cash transfers to at-risk populations to cover food and NFI needs during covid response; Emergency WASH assistance in urban informal settlements; Continuation of pediatric HIV service delivery through private health providers/","Caritas Kampala","Kampala, Kampala","Kampala, Kampala"
"ID-104","Welthungerhilfe","Covid 19 activities only","New Project","Coordination, Infection prevention, WASH, Risk communications, Logistics","Technical support to local governments on COVID_19 Response, Strengthen capacity of EHD and districts for WASH coordination, monitoring, supervision and information  management, Procure or construct IPC materials for health facilities, Procure WASH infrastructure, supplies and commodities to strengthen hygiene practices in affected communities, Conduct hygiene promotion and sensitization workshops on use of WASH commodities in congregational settings, Support community engagement meetings on improvement of WASH, Support the operationalization of WASH committees in the community., Procurement of Personal protective equipments (coveralls, masks, gloves, face shields, gumboots, N95 respirator, aprons, PPE full kit), Procurement of infared thermometers, None,","CEFORD, PALM, USSIA, KIFAD, JESE, SATNET, KIMA FOODS","Kampala, Karamoja, Teso, Toro, West Nile, Karamoja, Teso, Toro, West Nile, Kampala, Karamoja, Teso, Toro, West Nile, Acholi","Kampala, Moroto, Napak, Amuria, Katakwi, Kabarole, Kasese, Yumbe, Arua, Kampala, Moroto, Amuria, Kasese, Arua"
"ID-105","Plan International Uganda","COVID-19 Response","New Project","Coordination, Infection prevention, Surveillance, Laboratory, Case management, WASH, Risk communications, Logistics","Activation of National Task Force, district task force and sub-committees., Technical support to local governments on COVID_19 Response, Procure or construct IPC materials for health facilities, Conduct IPC refresher training and onsite mentorship on standard and transmission-based precautions, Orient Health workers on COVID-19 surveillance, Activate Ambulance services to aid referral of patients, Procurement of Personal protective equipments (coveralls, masks, gloves, face shields, gumboots, N95 respirator, aprons, PPE full kit), Procurement of sanitizers, None,","","Bukedi, Busoga, Lango, West Nile","Tororo, Kamuli, Buyende, Lira, Nebbi"
"ID-106","Voluntary Services Overseas (VSO)","COVID-19 Activities","Ongoing Project","Coordination, Infection prevention, Surveillance, Laboratory, Case management, WASH, ICT innovations, Risk communications, Logistics, Human resources","Conduct a simulation/drill exercise, Orientation for surge staff, Strengthen capacity of EHD and districts for WASH coordination, monitoring, supervision and information  management, Revise and disseminate adapted IPC standard operating procedures and strategy for IPC and hospital acquired infections for COVID-19 to health facilities, Procure or construct IPC materials for health facilities, Conduct IPC refresher training and onsite mentorship on standard and transmission-based precautions, Printing and distribution of  tools: case definition, case investigation, contact tracing, alert verificatio, immediate reporting forms, Orient Health workers on COVID-19 surveillance, Facilitation of point of entry supervisors, Orientation of Health care workers in Regional Referral Hospitals, Severe Acute Respiratory Illness (SARI) sentinel sites on mangemnet of suspect and confirmed cases, Assess public and private health facilities for COVID-19 readiness (including IPC capacity, on-site Oxygen production and supply, and logistics) on a quarterly basis., Activate Ambulance services to aid referral of patients, Support engagements with authorities on improvement of WASH in congregation institutions using the standardized checklist., Conduct hygiene promotion and sensitization workshops on use of WASH commodities in congregational settings, Support community engagement meetings on improvement of WASH, Support the operationalization of WASH committees in the community., Strengthen the District routine  reporting data,","","Acholi, Karamoja, West Nile, Acholi, Karamoja, West Nile","Gulu, Moroto, Napak, Madiokollo, Gulu"
"ID-107","International Rescue Committee (IRC)","Epidemic preparedness and response and life-saving health services to newly arrived refugees and vulnerable host community members in Uganda","New Project","Coordination, Infection prevention, Surveillance, Laboratory, Case management, Risk communications","Activation of National Task Force, district task force and sub-committees., Technical support to local governments on COVID_19 Response, Procure or construct IPC materials for health facilities, Conduct IPC refresher training and onsite mentorship on standard and transmission-based precautions, Conduct rapid risk and capacity assessments at district, critical point of entry and points of congregation. Identify priority risk groups based on current surveillance data and baseline risk assessment, Printing and distribution of  tools: case definition, case investigation, contact tracing, alert verificatio, immediate reporting forms, Orient Health workers on COVID-19 surveillance, Activate Ambulance services to aid referral of patients, None,","","Toro, West Nile, Toro, West Nile","Kyegegwa, Kasese, Kamwenge, Ntoroko, Yumbe, Adjumani, Arua, Madiokollo, Kyegegwa, Kasese, Kamwenge, Ntoroko, Yumbe, Adjumani, Arua"
"ID-108","International Rescue Committee (IRC)","Provision of Protection, Legal, Community-Based Protection Services, SGBV, Child Protection, Psychosocial Support and Health and Nutrition Services for Refugees residing in Arua, Yumbe, and Lamwo","New Project","Coordination, Infection prevention, Surveillance, Laboratory, Case management, Risk communications, Human resources","Activation of National Task Force, district task force and sub-committees., Technical support to local governments on COVID_19 Response, Revise and disseminate adapted IPC standard operating procedures and strategy for IPC and hospital acquired infections for COVID-19 to health facilities, Conduct IPC refresher training and onsite mentorship on standard and transmission-based precautions, Printing and distribution of  tools: case definition, case investigation, contact tracing, alert verificatio, immediate reporting forms, Orient Health workers on COVID-19 surveillance, Food assistance and/or specialised nutrition foods for suspects and health workers in isolation., Recruitment of surge staff,","","West Nile","Yumbe, Adjumani, Arua, Madiokollo"
"ID-109","International Rescue Committee (IRC)","U-LEARN (Uganda learning, evidence, and accountability research network) -Consortium led by Save","Ongoing Project","Risk communications","None,","","Kampala, Toro, West Nile","Kampala, Kyegegwa, Kasese, Ntoroko, Yumbe, Adjumani, Arua, Madiokollo"
"ID-110","Adventist Development & Relief Agency (ADRA)","COVID-19 Awareness & Mitigation Project","New Project","Coordination, Infection prevention, WASH, Risk communications","Strengthen capacity of EHD and districts for WASH coordination, monitoring, supervision and information  management, Revise and disseminate adapted IPC standard operating procedures and strategy for IPC and hospital acquired infections for COVID-19 to health facilities, Procure or construct IPC materials for health facilities, Conduct IPC refresher training and onsite mentorship on standard and transmission-based precautions, Support engagements with authorities on improvement of WASH in congregation institutions using the standardized checklist., Procure WASH infrastructure, supplies and commodities to strengthen hygiene practices in affected communities, Conduct hygiene promotion and sensitization workshops on use of WASH commodities in congregational settings, Support community engagement meetings on improvement of WASH, None,","Religious Leaders (IRCU members)","Acholi, Kampala, Karamoja, Toro, Acholi, Karamoja, Acholi","Kitgum, Agago, Pader, Kampala, Kaabong, Kotido, Abim, Kyegegwa, Kamwenge, Kitgum, Agago, Pader"
"ID-111","Adventist Development & Relief Agency (ADRA)","COVID-19 Awareness & Mitigation Project","New Project","other","None,","","",""
"ID-112","Joint UN Programme on HIV/AIDS  in Uganda (JUPSA)","Karamoja United Nations HIV programme (KARUNA)","Ongoing Project","Coordination, Infection prevention, Surveillance, Laboratory, Case management, WASH, ICT innovations, Mental health, Risk communications, Logistics, Human resources","Activation of National Task Force, district task force and sub-committees., Monitor and supervise implementation of the plan by the national level, Develop and issue information products including situational reports on COVID-19, Orientation for surge staff, Orientation and deployment of the COVID-19 National Rapid Response Team, Conduct rapid assessments by National Rapid Response Team, Technical support to local governments on COVID_19 Response, Facilitation of MoH Top Management Team in coordination and support to local governments, Strengthen capacity of EHD and districts for WASH coordination, monitoring, supervision and information  management, Revise and disseminate adapted IPC standard operating procedures and strategy for IPC and hospital acquired infections for COVID-19 to health facilities, Conduct IPC refresher training and onsite mentorship on standard and transmission-based precautions, Conduct surveillance for Hospital acquired infections for COVID-19 in health facilities., Conduct rapid risk and capacity assessments at district, critical point of entry and points of congregation. Identify priority risk groups based on current surveillance data and baseline risk assessment, Review, refine, and finalise surveillance guidelines, training materials and reporting tools, Printing and distribution of  tools: case definition, case investigation, contact tracing, alert verificatio, immediate reporting forms, Orient Health workers on COVID-19 surveillance, Identify all centres of risk and assess them for potential foci of undetected circulation of the virus, Orientation of high volume private facilities on detection and linking of suspect and confirmed cases to the designated isolation facilities,","Karamoja United Nations HIV Programme (KARUNA) IPs","Kampala, Karamoja, Kampala, Karamoja, Karamoja, Kampala","Kampala, Moroto, Kaabong, Nakapiripirit, Kotido, Napak, Abim, Amudat, Nabilatuk, Karenga, Kampala, Moroto, Amudat, Moroto"
"ID-113","Trocaire","COVID-19 EMERGENCY RESPONSE FUND PROJECT.","New Project","Coordination, WASH, Risk communications, Logistics, Human resources","Support engagements with authorities on improvement of WASH in congregation institutions using the standardized checklist., Procure WASH infrastructure, supplies and commodities to strengthen hygiene practices in affected communities, Conduct hygiene promotion and sensitization workshops on use of WASH commodities in congregational settings, Support community engagement meetings on improvement of WASH, Support the operationalization of WASH committees in the community., Procurement of sanitizers, Procurement of soap, Facilitation for COVID Response Teams,","Caritas Gulu and Don Bosco, Caritas Gulu and Don Bosco, Caritas Gulu and Don Bosco, Caritas Gulu and Don Bosco., Caritas Gulu and Don Bosco","Acholi","Lamwo"
"ID-114","Trocaire","COVID-19 Activities","Ongoing Project","Coordination, WASH, Mental health, Risk communications, Logistics, Human resources","Support engagements with authorities on improvement of WASH in congregation institutions using the standardized checklist., Procure WASH infrastructure, supplies and commodities to strengthen hygiene practices in affected communities, Conduct hygiene promotion and sensitization workshops on use of WASH commodities in congregational settings, Support community engagement meetings on improvement of WASH, Support the operationalization of WASH committees in the community., Deploy counsellors to communites and affected families to mitigate psychosocial effects of corona virus, Finalize psychosocial support materials, Procurement of soap, Procurement of water tanks, Facilitation for COVID Response Teams,  COVID-19 RESPONSE PROJECT IN ACHOLI AND TESO.","African Women Rising, Thrive Gulu, TEDDO, TERELEPR, MCJL, SOCADIWODA,GULU ARCH DIOCESE,SOCADIDO., African Women Rising, Thrive Gulu, TEDDO, TERELEPR, MCJL, SOCADIWODA,GULU ARCH DIOCESE,SOCADIDO., Thrive Gulu, African Women Rising, Thrive Gulu, TEDDO, TERELEPR, MCJL, SOCADIWODA,GULU ARCH DIOCESE,SOCADIDO., African Women Rising, Thrive Gulu, TEDDO, TERELEPR, MCJL, SOCADIWODA,GULU ARCH DIOCESE,SOCADIDO., African Women Rising, Thrive Gulu, TEDDO, TERELEPR, MCJL, SOCADIWODA, GULU ARCH DIOCESES, SOCADIDO.","Acholi, Teso, Acholi, Teso, Acholi","Lamwo, Gulu, Bukedea, Amuria, Katakwi, Kalaki, Lamwo, Gulu, Lamwo"
"ID-115","Trocaire","COVID-19 RESPONSE PROJECT IN ACHOLI AND TESO-UGANDA-IRISH EMBASSY","New Project","Coordination, WASH, Risk communications, Logistics, Human resources","Support engagements with authorities on improvement of WASH in congregation institutions using the standardized checklist., Procure WASH infrastructure, supplies and commodities to strengthen hygiene practices in affected communities, Conduct hygiene promotion and sensitization workshops on use of WASH commodities in congregational settings, Support community engagement meetings on improvement of WASH, Procurement of water tanks, Facilitation for COVID Response Teams,  Food distribution/support and food security; Radio programmes on GBV amidst; Access to other medical essential  services.services COVID-19","Caritas Gulu, Don Bosco and TEDDO, Caritas Gulu, Don Bosco and TEDDO, Caritas Gulu, Don Bosco and TEDDO, Caritas Gulu, Don Bosco and TEDDO, Caritas Gulu, Don Bosco and TEDDO","Acholi, Teso, Acholi, Teso","Lamwo, Bukedea, Kalaki, Lamwo"
"ID-116","Adventist Development & Relief Agency (ADRA)","COVID-19 Awareness & Mitigation Project","New Project","WASH, Risk communications","Support engagements with authorities on improvement of WASH in congregation institutions using the standardized checklist., Procure WASH infrastructure, supplies and commodities to strengthen hygiene practices in affected communities, Conduct hygiene promotion and sensitization workshops on use of WASH commodities in congregational settings, Support community engagement meetings on improvement of WASH, Support the operationalization of WASH committees in the community., None,","","Acholi, Kampala, Karamoja, Toro, Acholi, Kampala, Karamoja, Toro","Kitgum, Agago, Pader, Kampala, Kaabong, Kotido, Abim, Kyegegwa, Kamwenge, Kitgum, Agago, Pader"
"ID-117","Adventist Development & Relief Agency (ADRA)","COVID-19 Awareness and Mitigation Project (CAM)","New Project","other","None,  COVID-19 Awareness & Mitigation Project","","",""
"ID-118","AWO International","Preparing communities to prevent and respond to COVID-19 in Isingiro District of Uganda","New Project","WASH, Risk communications","Procure WASH infrastructure, supplies and commodities to strengthen hygiene practices in affected communities, Conduct hygiene promotion and sensitization workshops on use of WASH commodities in congregational settings, Support community engagement meetings on improvement of WASH, None,","COVOID Community Volunteer Initiative for Development, COVOID Community Volunteer Initiative for Development","Ankole","Isingiro"
"ID-119","AWO International","Mitigating effects of locust invasion meetingCoronavirus requirements for implementation in 2 districts in Karamoja","New Project","WASH, Risk communications","Procure WASH infrastructure, supplies and commodities to strengthen hygiene practices in affected communities, Support community engagement meetings on improvement of WASH, None,","ECO Ecological Christian Organisation, ECO Ecological Christian Organisation","Karamoja","Napak, Nabilatuk"
"ID-120","Mission Aviation Fellowship (MAF)","Covid-19 activities only","Ongoing Project","Logistics","Transport arrangements for medical staff, None,  provision of subsidised flight services to upcountry airfields to facilitate staff and cargo  transport","Church Mission NGO's and Government","Karamoja, West Nile","Moroto, Kaabong, Kotido, Amudat, Adjumani, Arua, Moyo"
"ID-121","ALIGHT ( Formerly American Refugee Committee)","COVID-19 Activities","New Project","Coordination, Infection prevention, WASH, Mental health, Human resources","Technical support to local governments on COVID_19 Response, Strengthen capacity of EHD and districts for WASH coordination, monitoring, supervision and information  management, Procure or construct IPC materials for health facilities, Support engagements with authorities on improvement of WASH in congregation institutions using the standardized checklist., Procure WASH infrastructure, supplies and commodities to strengthen hygiene practices in affected communities, Conduct hygiene promotion and sensitization workshops on use of WASH commodities in congregational settings, Support community engagement meetings on improvement of WASH, Support the operationalization of WASH committees in the community., Deploy counsellors to communites and affected families to mitigate psychosocial effects of corona virus, Supervise and monitor psychosocial services in the affected communities, Recruitment of surge staff,","Implemented by ALIGHT with Sub-grantees CBOs ( Wakati Foundation and Opportunigee), Implemented by ALIGHT with Sub-grantees CBOs ( Wakati Foundation and Opportunigee), Implemented by ALIGHT with Sub-grantees CBOs ( Wakati Foundation and Opportunigee)","Ankole","Isingiro"
"ID-122","Mission Aviation Fellowship (MAF)","COVID-19 activities only","Ongoing Project","other","None,  Flights to any of the airstrips within the country, MAF is able to provide subsidised air transport for church, mission and development agencies (NGO's) as well as government staff for emergency flights related to the Covid response under a MoH letter of authorisation","","Karamoja, West Nile","Moroto, Kaabong, Kotido, Amudat, Adjumani, Arua, Moyo"
