ProjectID,Partner,Project,Project_Status,Pillars_supported_by_project,Activities_conducted,Other_nonpPillar_activities,Implementing_partner,Regions,Districts
ID-37,Malteser International,Emergency Medical Services Project,ongoing project,"Case management, Logistics, other","Orientation of Health care workers in Regional Referral Hospitals, Severe Acute Respiratory Illness (SARI) sentinel sites on mangemnet of suspect and confirmed cases, Activate Ambulance services to aid referral of patients, Procurement of Personal protective equipments (coveralls, masks, gloves, face shields, gumboots, N95 respirator, aprons, PPE full kit)",Setting up of a COVID-19 Isolation Unit at Lubaga hospital.,"AAPU, Lubaga Hospital, Naguru hospital, Arua Regional Refferral","Kampala, West Nile","Kampala, Arua"
ID-38,Malteser International,Integrated Project for the improvement of Food & Nutrition Security and the provision of safe drinking water in underserved communities in the peri-urban areas of Wau and for the South Sudanese Refugees and their host communities in Northern Uganda.,ongoing project,"WASH, Logistics, Human resource","Procure WASH infrastructure, supplies and commodities to strengthen hygiene practices in affected communities Support community engagement meetings on improvement of WASH, improvement of WASH Procurement of soap",,,West Nile,"Yumbe, Arua, Madiokollo"
ID-39,Malteser International,AA Regional Emergency Response Project,ongoing project,"WASH, Logistics, Human resource","Procure WASH infrastructure, supplies and commodities to strengthen hygiene practices in affected communities Conduct hygiene promotion and sensitization workshops on use of WASH commodities in congregational settings, Procurement of sanitizers, Procurement of soap, Construction / rehabilitation of 10 sanitation facilities in health centres and hospitals",,,West Nile,"Arua, Madiokollo"
ID-4,Self Help Africa,Sustainable Livelihoods (SUSTAIN),ongoing project,"Coordination, Infection prevention, WASH, Risk communications, other","Revise and disseminate adapted IPC standard operating procedures and strategy for IPC and hospital acquired infections for COVID-19 to health facilities, Support engagements with authorities on improvement of WASH in congregation institutions using the standardized checklist. Procure WASH infrastructure, supplies and commodities to strengthen hygiene practices in affected communities Conduct hygiene promotion and sensitization workshops on use of WASH commodities in congregational settings, Support community engagement meetings on improvement of WASH, ",Provision of agricultural inputs for 1000 households,District Local Government,West Nile,Adjumani
ID-40,Finnish Mission Uganda / Fida International,Health Component,ongoing project,"Coordination, Infection prevention, Surveillance, WASH, Mental health, Risk communications, Logistics, other","Facilitation of MoH Top Management Team in coordination and support to local governments, Revise and disseminate adapted IPC standard operating procedures and strategy for IPC and hospital acquired infections for COVID-19 to health facilities, Procure WASH infrastructure, supplies and commodities to strengthen hygiene practices in affected communities Deploy counsellors to communites and affected families to mitigate psychosocial effects of corona virus cash, Procurement of Personal protective equipments (coveralls, masks, gloves, face shields, gumboots, N95 respirator, aprons, PPE full kit), ",Education In Emergencies,Pentecostal Churches of Uganda,"Bunyoro, Kampala, Teso, West Nile","Masindi, Kakumiro, Hoima, Kampala, Amuria, Yumbe, Nebbi, Yumbe, Buliisa, Kiryandongo, Soroti, Amuria"
ID-41,Finnish Mission Uganda / Fida International,Education Component,ongoing project,"WASH, Mental health, other","Pay Deploy counsellors to communites and affected families to mitigate psychosocial effects of corona virus UTL toll free for call center,",Provision of Learning Materials to vulnerable children,,West Nile,Yumbe
ID-42,World Vision Uganda,COVID19 Actvities,ongoing project,"WASH, Mental health, Risk communications, Logistics, Human resource","Support engagements with authorities on improvement of WASH in congregation institutions using the standardized checklist. Procure WASH infrastructure, supplies and commodities to strengthen hygiene practices in affected communities Conduct hygiene promotion and sensitization workshops on use of WASH commodities in congregational settings, Support community engagement meetings on improvement of WASH, Support the operationalization of WASH committees in the community, Deploy counsellors to communites and affected families to mitigate psychosocial effects of corona virusSupervise and monitor psychosocial services in the affected communities by the central team, Finalize psychosocial support materials supplies personnel, Procurement of Personal protective equipments (coveralls, masks, gloves, face shields, gumboots, N95 respirator, aprons, PPE full kit), Procure disinfection consumables and biohazard waste management (bin liners, alcohol hand rub, jiks, spray pumps), Procurement of infared thermometers, Provision of mattresses and beddings for isolation centres Purchase Megaphones for VHTs for use at sub county level, Procurement of sanitizers,Provision of foot operated handwashing facilities, Procurement of soap, Water, Sanitation & Hygiene transportation, last mile distribution, and other logistics costs, Support Call Centre operators (volunteers) working in 3 shifts",,,"Acholi, Bukedi, Bunyoro, Busoga, Elgon, Kampala, Karamoja, Lango, North Buganda, South Buganda, Teso, Toro, Westnile","Omoro, Gulu, Agago, Pader, Busia, Tororo, Butaleja, Kagadi, Kibaale, Buliisa, Hoima, Bugiri, Mayuge, Mbale, Kampala, Kaabong, Kotido, Abim, Karenga, Kole, Oyam, Buikwe, Kiboga, Mpigi, Rakai, Soroti, Amuria, Kapelebyong, Kamwenge, Bundibugyo, Yumbe, Adjumani, Arua, Moyo, Obongi, Omoro, Agago, Pader, Busia, Butaleja, Mpigi, Butambala, Rakai, Omoro, Gulu, Agago, Pader, Kagadi, Kibaale, Kikuube, Buliisa, Hoima, Kibaale, Kikuube, Buliisa, Hoima, Kole, Otuke"
ID-43,Doctors with Africa CUAMM,COVID-19 activities only,ongoing project,"Coordination, Infection prevention, Surveillance, Case management, WASH, ICT innovations, Risk communications, Logistics, Human resource","Activation of National Task Force, district task force and sub-committees, Develop and issue information products including situational reports on COVID-19, Orientation for surge staff Technical support to local governments on COVID-19, Strengthen capacity of EHD and districts for WASH coordination, monitoring, supervision and information management,Revise and disseminate adapted IPC standard operating procedures and strategy for IPC and hospital acquired infections for COVID-19 to health facilities, Procure or construct IPC materials for health facilities, Conduct IPC refresher training and onsite mentorship on standard and transmission-based precautions,Printing and distribution of tools: case definition, case investigation, contact tracing, alert verificatio, immediate reporting forms, Orient Health workers on COVID-19 surveillance, Identify all centres of risk and assess them for potential foci of undetected circulation of the virus,Contact identification, contact tracing, and contact follow up and contacts of contacts, Orientation of Health care workers in Regional Referral Hospitals, Severe Acute Respiratory Illness (SARI) sentinel sites on mangemnet of suspect and confirmed cases, Assess public and private health facilities for COVID-19 readiness (including IPC capacity, on-site Oxygen production and supply, and logistics) on a quarterly basis. Activate Ambulance services to aid referral of patients, Delivery of medicines to patients isolated at home. This could also cover other conditions like HIV, NCDs (To be piloted), Procure WASH infrastructure, supplies and commodities to strengthen hygiene practices in affected communities Strengthen the District routine reporting data, Personnel, Procurement of Personal protective equipments (coveralls, masks, gloves, face shields, gumboots, N95 respirator, aprons, PPE full kit), Procurement of medicines and supplies for patient management, Procure disinfection consumables and biohazard waste management (bin liners, alcohol hand rub, jiks, spray pumps), Procurement of infared thermometers, Procurement of other medical equipment, Purchase Megaphones for VHTs for use at sub county level, Printing of the Public Health (COVID 19) Statutory Instrument, Procurement of sanitizers, Procurement of soap, Chlorination, Procure boots, Facilitation for Laboratory field sample collection officers and riders - Central region",,,"Karamoja, Lango","Moroto, Nakapiripirit, Napak, Amudat, Nabilatuk, Oyam"
ID-44,Doctors with Africa CUAMM,COVID-19 Activities only,ongoing project,"Case management, ICT innovations, other","Orientation of Health care workers in Regional Referral Hospitals, Severe Acute Respiratory Illness (SARI) sentinel sites on mangemnet of suspect and confirmed cases, Assess public and private health facilities for COVID-19 readiness (including IPC capacity, on-site Oxygen production and supply, and logistics) on a quarterly basis. Activate Ambulance services to aid referral of patients, Delivery of medicines to patients isolated at home. This could also cover other conditions like HIV, NCDs (To be piloted), Strengthen the District routine reporting data ",,,Karamoja,"Moroto, Nakapiripirit, Napak, Amudat, Nabilatuk"
ID-45,LifeNet International,Medical Training & Quality of Care Improvement,ongoing project,"Coordination, Infection prevention, Surveillance, Case management, WASH, ICT innovations,  Risk communications, Logistics, other","Develop and issue information products including situational reports on COVID-19, Strengthen capacity of EHD and districts for WASH coordination, monitoring, supervision and information management, Revise and disseminate adapted IPC standard operating procedures and strategy for IPC and hospital acquired infections for COVID-19 to health facilities, Procure or construct IPC materials for health facilities, Conduct IPC refresher training and onsite mentorship on standard and transmission-based precautions, Conduct surveillance for Hospital acquired infections for COVID-19 in health facilities, Orient Health workers on COVID-19 surveillance, Assess public and private health facilities for COVID-19 readiness (including IPC capacity, on-site Oxygen production and supply, and logistics) on a quarterly basis. Delivery of medicines to patients isolated at home. This could also cover other conditions like HIV, NCDs (To be piloted), Support engagements with authorities on improvement of WASH in congregation institutions using the standardized checklist. Procure WASH infrastructure, supplies and commodities to strengthen hygiene practices in affected communities Conduct hygiene promotion and sensitization workshops on use of WASH commodities in congregational settings, Support community engagement meetings on improvement of WASH, improvement of WASH supplies personnel, Procurement of Personal protective equipments (coveralls, masks, gloves, face shields, gumboots, N95 respirator, aprons, PPE full kit), Procurement of infared thermometers, Offloadingand transportation of commoditiesProcurement of sanitizers, Procurement of soap, Procurement of water tanks Water, Sanitation & Hygiene transportation, last mile distribution, and other logistics costs",,,"Busoga, Kampala, North Buganda, South Buganda","Iganga, Jinja, Mayuge, Kampala, Buikwe, Luwero, Nakasongola, Mubende, Mukono, Nakaseke, Mityana, Masaka, Wakiso, Bukomansimbi, Mpigi, Lwengo, Ssembabule, Butambala, Rakai, Iganga"
ID-46,Broederlijk Delen,COVID-19 activities only,ongoing project,"Risk communications, other",Cash ,,"FAPAD in Lira and Amolatar, KRC in Fort Portal / Kabarole","Lango, Toro","Amolatar, Lira, Kabarole"
ID-47,Danish Refugee Council,UNHCR protection programming (refugee support),ongoing project,"Coordination, Case management, WASH, ICT innovations, Mental health, Risk communications, Logistics, Human resource","Accomodation and food assistance for quarantineed individuals in hotels, Welfare and food assistance for quarantineed individuals in other institutions, Delivery of medicines to patients isolated at home. This could also cover other conditions like HIV, NCDs (To be piloted), Conduct hygiene promotion and sensitization workshops on use of WASH commodities in congregational settings, Support community engagement meetings on improvement of WASH, improvement of WASH Implement Budget tracking and activity reporting system for the COVID-19 response, Widen scope of implementation of eMeeting, Emergency Hotline, Deploy counsellors to communites and affected families to mitigate psychosocial effects of corona virusSupervise and monitor psychosocial services in the affected communities by the central team, Finalize psychosocial support materials, Personnel, Procurement of Personal protective equipments (coveralls, masks, gloves, face shields, gumboots, N95 respirator, aprons, PPE full kit), Ensure remuneration and compensation of responders",,HADS in Lobule,West Nile,"Arua, Koboko"
ID-48,Danish Refugee Council,NURI,ongoing project,"Coordination, Risk communications, Logistics, Human resource","Technical support to local governments on COVID-19, Strengthen capacity of EHD and districts for WASH coordination, monitoring, supervision and information management, Personnel, Procurement of Personal protective equipments (coveralls, masks, gloves, face shields, gumboots, N95 respirator, aprons, PPE full kit), Ensure remuneration and compensation of responders",Cash for work for communities (small group of 5) and fuel support to district task force,,"Acholi, West Nile","Lamwo, Kitgum, Agago, Pakwach, Zombo, Adjumani, Arua, Nebbi, Koboko, Moyo, Madiokollo"
ID-49,Danish Refugee Council,DANIDA protection programming (refugee support),ongoing project,"WASH, Risk communications, Human resource","Procure WASH infrastructure, supplies and commodities to strengthen hygiene practices in affected communities Conduct hygiene promotion and sensitization workshops on use of WASH commodities in congregational settings, Support community engagement meetings on improvement of WASH, Support the operationalization of WASH committees in the community,supplies personnel, Ensure remuneration and compensation of responders",,,West Nile,Arua
ID-5,Self Help Africa,"Increasing Household Income and Livelihoods for Women and Youth in Teso, North-east Uganda",ongoing project,"Infection prevention, WASH, Risk communications, Logistics, other","Revise and disseminate adapted IPC standard operating procedures and strategy for IPC and hospital acquired infections for COVID-19 to health facilities, Support engagements with authorities on improvement of WASH in congregation institutions using the standardized checklist. Procure WASH infrastructure, supplies and commodities to strengthen hygiene practices in affected communities Conduct hygiene promotion and sensitization workshops on use of WASH commodities in congregational settings, Support community engagement meetings on improvement of WASH, ",Distribution of assorted seeds and inputs for 1000 households,"Volutary Action for Development (VAD), District Local Government (DLG)",Teso,Kapelebyong
ID-50,Danish Refugee Council,EUTF Support Programme to the Refugee Settlements and Host Communities in Northern Uganda (SPRS-NU),ongoing project,"Risk communications, Logistics, Human resource","Personnel, Procurement of Personal protective equipments (coveralls, masks, gloves, face shields, gumboots, N95 respirator, aprons, PPE full kit), Ensure remuneration and compensation of responders","Direct materials support to district task force (fuel, transport","CEFORD, Save the children",West Nile,"Yumbe, Adjumani"
ID-51,Danish Refugee Council,ECHO cash programming (refugee support),ongoing project,"Risk communications, Logistics, Human resource","Personnel, Procurement of Personal protective equipments (coveralls, masks, gloves, face shields, gumboots, N95 respirator, aprons, PPE full kit), Ensure remuneration and compensation of responders",Unconditional cash support to cover basic non food needs to most vulnerable new arrivals refugees,,"Ankole, Toro","Isingiro, Kyegegwa"
ID-52,Samaritan's Purse,COVID-19 activities only,ongoing project,"Logistics, other","Procurement of Personal protective equipments (coveralls, masks, gloves, face shields, gumboots, N95 respirator, aprons, PPE full kit), ",,,Kampala,Kampala
ID-53,Samaritan's Purse,COVID-19 Response,new project,"Infection prevention, WASH, Risk communications, Logistics, other","Procure or construct IPC materials for health facilities, Support engagements with authorities on improvement of WASH in congregation institutions using the standardized checklist. Procure WASH infrastructure, supplies and commodities to strengthen hygiene practices in affected communities Conduct hygiene promotion and sensitization workshops on use of WASH commodities in congregational settings, Support community engagement meetings on improvement of WASH, Support the operationalization of WASH committees in the community,supplies personnel, Procurement of Personal protective equipments (coveralls, masks, gloves, face shields, gumboots, N95 respirator, aprons, PPE full kit),Provision of foot operated handwashing facilities, Procurement of soap, Improvement of WASH facilities in Isolation/Quaranteen centres, Construction / rehabilitation of 10 sanitation facilities in health centres and hospitals Mobile toilet for isolation centers, ",,,Kampala,Kampala
ID-54,Womena Uganda,Menstrual health intervention in relation to Gender-based violence (GBV),new project,"Coordination, Case management, WASH, Risk communications, Logistics, Human resource","Develop and issue information products including situational reports on COVID-19, Orientation for surge staff Technical support to local governments on COVID-19, Strengthen capacity of EHD and districts for WASH coordination, monitoring, supervision and information management, Procure WASH infrastructure, supplies and commodities to strengthen hygiene practices in affected communities Conduct hygiene promotion and sensitization workshops on use of WASH commodities in congregational settings, Support community engagement meetings on improvement of WASH, Support the operationalization of WASH committees in the community, supplies, Procure disinfection consumables and biohazard waste management (bin liners, alcohol hand rub, jiks, spray pumps), Procurement of sanitizers, Procurement of soap, Ensure remuneration and compensation of responders,",,,"Acholi, Bunyoro, Kampala, Westnile","Gulu, Hoima, Kampala, Adjumani"
ID-55,Jesuit Regufee Service (JRS),Kampala Project,ongoing project,"Coordination, Case management, Mental health, Risk communications, Logistics, other","personnel, Procure disinfection consumables and biohazard waste management (bin liners, alcohol hand rub, jiks, spray pumps), Procurement of soap",,,Kampala,Kampala
ID-56,Jesuit Regufee Service (JRS),Adjumani Project,ongoing project,"Coordination, Mental health, other",Technical support to local governments on COVID-19,,,West Nile,Adjumani
ID-57,U-LEARN,COVID-19 Activities Only,ongoing project,"Surveillance, ICT innovations, Risk communications, other","Conduct rapid risk and capacity assessments at district, critical point of entry and points of congregation. Identify priority risk groups based on current surveillance data and baseline risk assessment, Implement Budget tracking and activity reporting system for the COVID-19 response, Sofware development personnel, ",,,Kampala,Kampala
ID-58,Conservation Through Public Health,"Training of park staff, porters, community volunteers and Village  Health  and Conservation Teams in containing COVID-19",new project,"Coordination, Infection prevention, Surveillance, WASH, Risk communications, Logistics, other","Technical support to local governments on COVID-19,  Conduct IPC refresher training and onsite mentorship on standard and transmission-based precautions,Contact identification, contact tracing, and contact follow up and contacts of contacts, Support engagements with authorities on improvement of WASH in congregation institutions using the standardized checklist. Procure WASH infrastructure, supplies and commodities to strengthen hygiene practices in affected communities Conduct hygiene promotion and sensitization workshops on use of WASH commodities in congregational settings, Support community engagement meetings on improvement of WASH, Procurement of Personal protective equipments (coveralls, masks, gloves, face shields, gumboots, N95 respirator, aprons, PPE full kit), Procurement of soap",,"Uganda Wildlife Authority, Bwindi Community Hospital, Mountain Gorilla Veterinary Project, Max Planck Institute, Internatinal Gorilla Conservation Programme, Solidaridad",Kigezi,"Rubanda, Kanungu, Kisoro"
ID-6,CARE International  Uganda,Women Adolescent and Youth Rights and Empowerment Project (WAY),ongoing project,"Infection prevention, Risk communications, other","Procure or construct IPC materials for health facilities, supplies",,,"Acholi, West Nile","Lamwo, Amuru, Kitgum, Agago, Yumbe, Adjumani, Arua, Moyo, Madiokollo, Obongi"
ID-60,ChildFund International,Community resilience against COVID-19 through WASH and social protection,new project,"Coordination, WASH, ICT innovations, Risk communications, Logistics, other","Strengthen capacity of EHD and districts for WASH coordination, monitoring, supervision and information management, Procure WASH infrastructure, supplies and commodities to strengthen hygiene practices in affected communities Conduct hygiene promotion and sensitization workshops on use of WASH commodities in congregational settings, Support community engagement meetings on improvement of WASH, improvement of WASH, Widen scope of implementation of eMeeting, Procurement of water tanks",,"Mbale Area Federation of Communities(MAFOC), Busia Area Communities Federation(BUACOFE)","Bukedi, Elgon","Busia, Bududa, Manafwa, Mbale, Butaleja, Kibuku, Sironko, Bulambuli"
ID-61,ChildFund International,COVID-19 Activities only,ongoing project,"Coordination, WASH, ICT innovations, Mental health, Risk communications, Logistics, other","Activation of National Task Force, district task force and sub-committees, Develop and issue information products including situational reports on COVID-19, Support engagements with authorities on improvement of WASH in congregation institutions using the standardized checklist. Procure WASH infrastructure, supplies and commodities to strengthen hygiene practices in affected communities, Support community engagement meetings on improvement of WASH, improvement of WASH, Widen scope of implementation of eMeeting, Deploy counsellors to communites and affected families to mitigate psychosocial effects of corona virus, Supervise and monitor psychosocial services in the affected communities by the central team, Finalize psychosocial support materials, Procure disinfection consumables and biohazard waste management (bin liners, alcohol hand rub, jiks, spray pumps), Water, Sanitation & Hygiene transportation, last mile distribution, and other logistics costs",,"Acholi Child and Family Programme (ACFP), Masindi Child Development Federation (MACDEF), Lango Child and Community Development Federation (LACCODEF), Community Efforts for Child Empowerment (CECE), Kampala Area Federation of Communities (KAFOC), Jinja Area Communities Federation (JIACOFE), Partners for Children Worldwide (PfCW), Mbale Area Federation of Communities (MAFOC), Busia Area Communities Federation (BUACOFE)","Acholi, Bukedi ,Bunyoro, Busoga, Elgon, Kampala, Lango, North Buganda, South Buganda, Teso","Kitgum, Gulu, Agago, Busia, Budaka, Butaleja, Kibuku, Masindi, Kiryandongo, Kamuli, Jinja, Mayuge, Sironko, Mbale, Bulambuli, Kampala, Kole, Dokolo, Kwania, Kyankwanzi, Wakiso, Kaberamaido, Soroti, Serere, Amuria, Katakwi, Kapelebyong"
